{
  "format": "matrix-mult-bilinear-v1",
  "domain": "Q",
  "dimensions": {
    "m": 2,
    "k": 2,
    "n": 2
  },
  "declared_rank": 7,
  "terms": [
    {
      "a": [
        "1",
        "0",
        "0",
        "1"
      ],
      "b": [
        "1",
        "0",
        "0",
        "1"
      ],
      "c": [
        "1",
        "0",
        "0",
        "1"
      ]
    },
    {
      "a": [
        "0",
        "0",
        "1",
        "1"
      ],
      "b": [
        "1",
        "0",
        "0",
        "0"
      ],
      "c": [
        "0",
        "0",
        "1",
        "-1"
      ]
    },
    {
      "a": [
        "1",
        "0",
        "0",
        "0"
      ],
      "b": [
        "0",
        "1",
        "0",
        "-1"
      ],
      "c": [
        "0",
        "1",
        "0",
        "1"
      ]
    },
    {
      "a": [
        "0",
        "0",
        "0",
        "1"
      ],
      "b": [
        "-1",
        "0",
        "1",
        "0"
      ],
      "c": [
        "1",
        "0",
        "1",
        "0"
      ]
    },
    {
      "a": [
        "1",
        "1",
        "0",
        "0"
      ],
      "b": [
        "0",
        "0",
        "0",
        "1"
      ],
      "c": [
        "-1",
        "1",
        "0",
        "0"
      ]
    },
    {
      "a": [
        "-1",
        "0",
        "1",
        "0"
      ],
      "b": [
        "1",
        "1",
        "0",
        "0"
      ],
      "c": [
        "0",
        "0",
        "0",
        "1"
      ]
    },
    {
      "a": [
        "0",
        "1",
        "0",
        "-1"
      ],
      "b": [
        "0",
        "0",
        "1",
        "1"
      ],
      "c": [
        "1",
        "0",
        "0",
        "0"
      ]
    }
  ]
}
